{
  "$schema": "https://json-schema.org/draft/2020-12/schema",
  "$id": "cbsp21_patch_manifest_v2",
  "title": "CBSP21 Patch Manifest v2 (code-analysis-tool)",
  "description": "v2 adds the fields the pr_scope detector needs: an immutable pinned base commit, an optional pinned head, and a minimum in-scope coverage threshold. All v1 fields remain.",
  "type": "object",
  "additionalProperties": false,
  "required": [
    "schema_version",
    "patch_id",
    "title",
    "intent",
    "change_type",
    "behavior_change",
    "risk_level",
    "scope",
    "diff_range",
    "changed_files_count",
    "diff_articulation",
    "verification",
    "file_context_coverage_percent"
  ],
  "properties": {
    "schema_version": {
      "type": "string",
      "const": "cbsp21_patch_manifest_v2"
    },
    "patch_id": { "type": "string", "minLength": 1 },
    "title": { "type": "string", "minLength": 1 },
    "intent": { "type": "string", "minLength": 1 },
    "change_type": {
      "type": "string",
      "enum": ["code", "docs", "config", "ci", "refactor", "test", "security"]
    },
    "behavior_change": {
      "type": "string",
      "enum": ["compatible", "breaking", "unknown"]
    },
    "risk_level": {
      "type": "string",
      "enum": ["low", "medium", "high"]
    },
    "scope": {
      "type": "object",
      "additionalProperties": false,
      "description": "The authorized change surface. At least one of files_expected_to_change / paths_in_scope must be non-empty; an empty scope is rejected by pr_scope rather than flagging every changed file.",
      "anyOf": [
        { "required": ["files_expected_to_change"] },
        { "required": ["paths_in_scope"] }
      ],
      "properties": {
        "paths_in_scope": {
          "type": "array",
          "items": { "type": "string", "minLength": 1 },
          "minItems": 1,
          "uniqueItems": true,
          "description": "Directory prefixes. A changed file is declared if it sits under any of these (e.g. \"src/code_audit/analyzers/\")."
        },
        "files_expected_to_change": {
          "type": "array",
          "items": { "type": "string", "minLength": 1 },
          "minItems": 1,
          "uniqueItems": true,
          "description": "File paths or fnmatch glob patterns (e.g. \"tests/fixtures/expected/*.json\"). Note that \"*\" also matches \"/\", so a glob can span directories."
        },
        "out_of_scope_notes": { "type": "string" },
        "min_coverage_percent": {
          "type": "integer",
          "minimum": 95,
          "maximum": 100,
          "default": 95,
          "description": "Minimum percentage of merge-base..HEAD changed files that must fall inside the declared scope. 95 is the acceptance-contract floor; this field may only raise the bar, never lower it, and fractional thresholds are not supported."
        },
        "dependency_changes": {
          "type": "array",
          "uniqueItems": true,
          "description": "Dependencies whose version this change intentionally moves inside a declared package.json. This is the only declaration pr_scope accepts for rule pr_scope.undeclared_dependency_change; naming a dependency in diff_articulation prose is recorded on the finding but does not declare it.",
          "items": {
            "oneOf": [
              { "type": "string", "minLength": 1 },
              {
                "type": "object",
                "additionalProperties": false,
                "required": ["name"],
                "properties": {
                  "name": { "type": "string", "minLength": 1 },
                  "from": { "type": "string" },
                  "to": { "type": "string" },
                  "reason": { "type": "string" }
                }
              }
            ]
          }
        }
      }
    },
    "diff_range": {
      "type": "object",
      "additionalProperties": false,
      "required": ["base", "base_sha", "head"],
      "properties": {
        "base": {
          "type": "string",
          "minLength": 1,
          "description": "Base ref (e.g. \"main\") that pr_scope resolves and passes to `git merge-base` to compute the actual merge-base."
        },
        "base_sha": {
          "type": "string",
          "pattern": "^[0-9a-fA-F]{40}([0-9a-fA-F]{24})?$",
          "description": "Immutable pinned merge-base commit. pr_scope compares it against the merge-base actually computed from `base` and raises a HIGH base-drift finding if they differ. Required: without a pin, drift detection would silently never run."
        },
        "pinned_merge_base": {
          "type": "string",
          "pattern": "^[0-9a-fA-F]{40}([0-9a-fA-F]{24})?$",
          "description": "Deprecated alias for base_sha, accepted for manifests written against the earlier v2 draft. Prefer base_sha; if both are present, base_sha wins."
        },
        "head": { "type": "string", "minLength": 1 },
        "head_sha": {
          "type": "string",
          "pattern": "^[0-9a-fA-F]{40}([0-9a-fA-F]{24})?$",
          "description": "Optional pinned head commit. When set, pr_scope raises a HIGH head-drift finding if the reviewed head has moved."
        }
      }
    },
    "changed_files_count": {
      "type": "integer",
      "minimum": 0,
      "description": "Declared count of changed files. pr_scope reconciles this against the real diff and raises HIGH on mismatch."
    },
    "changed_files_exact": {
      "type": "array",
      "items": { "type": "string", "minLength": 1 },
      "uniqueItems": true,
      "description": "Declared exact changed-file list. pr_scope reconciles this against the real diff and raises HIGH on mismatch, reporting manifest_only / git_only. This is a cross-check, NOT an authorization list — scope is granted only by scope.files_expected_to_change / scope.paths_in_scope."
    },
    "diff_articulation": {
      "type": "object",
      "additionalProperties": false,
      "required": ["what_changed", "why_not_redundant"],
      "properties": {
        "what_changed": {
          "type": "array",
          "items": { "type": "string", "minLength": 1 },
          "minItems": 1
        },
        "why_not_redundant": { "type": "string", "minLength": 1 }
      }
    },
    "verification": {
      "type": "object",
      "additionalProperties": false,
      "required": ["commands_run"],
      "properties": {
        "commands_run": {
          "type": "array",
          "items": { "type": "string", "minLength": 1 },
          "minItems": 1
        },
        "test_results": {
          "type": "array",
          "items": { "type": "string" }
        },
        "notes": { "type": "string" }
      }
    },
    "file_context_coverage_percent": {
      "type": "number",
      "minimum": 0,
      "maximum": 100,
      "description": "Author's declaration of how much of each touched file's context was actually read before editing (a review-discipline metric, NOT test coverage and NOT the scope-coverage figure pr_scope computes from the diff). pr_scope holds it to the same threshold as scope coverage; metadata.triggered_by names which metric tripped."
    },
    "metadata": {
      "type": "object",
      "additionalProperties": true,
      "properties": {
        "author": { "type": "string" },
        "created_at": { "type": "string", "format": "date-time" },
        "reviewers": { "type": "array", "items": { "type": "string" } }
      }
    }
  }
}
